paper_id,important_segment,label,Fold_Id
122,"focus of attention was far removed from the distractors. We found that selective processing of the targets improved in Experiments 2 and 3 relative to Experiment 1, to the extent that in Experiments 2 and 3, participants performed at chance level when asked to localize a single missing distractor. In contrast, we found in all experiments that participants could accurately localize the distractor centroid, even when individual distractors were localized at chance levels. This finding suggests that the cost of withdrawing attention from distractors can be compensated for by pooling together noisy local signals and computing summary statistics.",1.0,5.0
124,"can serve as psychological tools that justify and maintain social inequality. For example, Jackman (1994) has suggested that ascribing favorable and flattering, but clearly stereotypical, traits to women reduces resistance to gender-based role divisions (also see Hoffman & Hurst, 1990) by subtly implying that women are well suited to the roles they have traditionally occupied, and that stereotypically feminine traits are valued by society (also see Jost & Kay, 2005). Elaborating on this idea, Glick and Fiske (1996) developed a measure of such stereotypes and demonstrated, across 19 countries, that the tendency to engage in this form of ‘‘benevolent sexism’’",0.0,1.0
127,"extrapolation of motion paths (Freyd, 1983). For example, in the top photograph in Figure 1a, it is easy to see a sprinter running to the left. The sense of motion must be inferred from prior knowledge; there is, of course, no physical motion in the photograph. Such stimuli would appear to have little in common with the drifting dots and gratings commonly used to study neural mechanisms of motion processing, other than the fact that the observer knows that both types of stimuli depict motion in some sense. In the study reported here, we investigated how the sense of motion",1.0,2.0
129,"2Copyright r 2008 Association for Psychological Science attention regarding threatening stimuli (e.g., angry facial expressions; Bar-Haim, Lamy, Pergamin, Bakermans-Kranenburg, & van Ijzendoorn, 2007; Fox, Russo, & Dutton, 2002). Drawing on this research, the present work employed a common test of attentional bias known as the dot-probe detection paradigm (MacLeod et al., 1986) to examine attentional biases to Black, relative to White, faces (see also Eberhardt, Goff, Purdie, & Davies, 2004). In this paradigm, the participant’s task is to detect the location of a probe, such as a small dot, that is initially hidden from view behind one of two stimuli",0.0,5.0
133,"unrelated words to a survival scenario subsequently remembered those words better than participants who processed those same words in several deep-processing control conditions (instructions to rate pleasantness, relevance to moving to a foreign land, or ease of generating an autobiographical memory). The purpose of the present research was to test the true mettle of survival-based processing by pitting the survival scenario against a set of encoding procedures that are universally accepted as producing excellent retention. Memory theorists generally dismiss the notion that one kind of encoding task is inherently better than another, because the nature of the retrieval environment needs",1.0,5.0
134,"have what they want must be both distinct and quantifiable. However wise the maxim sounds, it may not even be clear what it means for people to want what they have as opposed to have what they want. Fortunately, probability theory clarifies what it means for people to want what they have and have what they want, and it provides a framework for measuring these variables. Let us first quantify the extent to which people want what they have. LetHave represent the set of material items that an individual has (e.g., bed, stereo, car; see the shaded area in Fig.",1.0,8.0
135,"keep their evaluations straight and enables them to prevent the actions of one individual from influencing their judgments of another. With time, however, the details that maintain clear distinctions between the behaviors of different individuals are forgotten (Johnson, Hashtroudi, & Lindsay, 1993). Brainerd and Reyna’s fuzzy-trace theory, for example, distinguishes between gist memory (memory for the general meaning of informational inputs) and verbatim memory (more exact representation of the specific content of informational inputs; Reyna & Brainerd, 1995). According to this theory, verbatim memory is forgotten and becomes inaccessible quickly, leaving people to rely on gist memory (Clark & Clark,",1.0,7.0
136,"After reading their assigned material, participants completed the Free Will and Determinism scale (FWD; Paulhus & Margesson, 1994) and the Positive and Negative Affectivity Schedule (PANAS; Watson, Clark, & Tellegen, 1988), which we used to assess whether the reading manipulation affected their beliefs and mood. Subsequently, participants were given a computer-based mental-arithmetic task (von Hippel, Lakin, & Shakarchi, 2005) in which they were asked to calculate the answers to 20 problems (e.g., 11 81 18 121 19 71 17 21 8 45 ?), presented individually. They were told that the computer had a programming glitch and the correct answer would",1.0,6.0
145,"norms of groupbased altruism are strengthened, punishment and rejection of defectors are increased, and perceptions of the in-group and outgroup are manipulated (Brewer & Campbell, 1976; Campbell, 1965; Levine & Campbell, 1972; Sherif, 1966). Throughout human history, groups with more effective means of instilling self-sacrifice in their members have prevailed over groups with less effective solidarity mechanisms, thereby propagating their Address correspondence to Nir Halevy, School of Business Administration, The Hebrew University of Jerusalem, Mount Scopus, Jerusalem 91905, Israel, e-mail: nyh@mscc.huji.ac.il. Volume 19—Number 4 405Copyright r 2008 Association for Psychological Science altruistic (i.e., ethnocentric) norms and institutions (Bernhard, Fischbacher, &",1.0,8.0
150,"of space. A study by Bekkering and Neggers (2002) provides converging evidence from normal observers. In this study, participants either pointed to or grasped a target defined by a conjunction of its orientation and color. Saccades to distractors having the same orientation as the target were more likely when a grasping response was made than when a pointing response was made. This suggests that contrasting actions can differentially weight visual information, with orientation being weighted more strongly for selection when a grasping rather than a pointing response is required (see also Hannus, Cornelissen, Lindemann, & Bekkering, 2005). These data are",1.0,2.0
153,"locations (see also Huggins & Zucker, 2001a, 2001b). Situations in which the non-EE side is closer or touching the EE are highly accidental. Therefore, if the visual Address correspondence to Stephen E. Palmer, Department of Psychology, University of California, Berkeley, Berkeley, CA 94720- 1650, e-mail: palmer@cogsci.berkeley.edu. 1EEs have been used to produce figural biases, but we know of no prior systematic psychophysical studies of the effects of EEs on figure-ground organization. Shepard (1990, p. 72) used shading EEs in an ambiguous figureground drawing titled ‘‘Beckoning Balusters,’’ and Diane Beck used them to bias the figural side of figure-ground displays in",1.0,5.0
155,"up, or down. Thus, an association between dominance and facilitation of perception along the vertical dimension on this task would be due to relatively automatic perceptual processes. The inclusion of the horizontal trials was not theoretically motivated, but rather allowed us to systematically control for individual differences in speed, which are quite pronounced on nearly any choice reaction time task (Jensen, 1998; Robinson & Oishi, 2006). In our second study, we also administered a spatial attention task in which the location of the spatial probes was perfectly predictable because they alternated between an upper position and a lower position (in",0.0,2.0
161,"found for non-threat-relevant animals (e.g., bears, dogs, and kittens; Tipples et al., 2002). In addition, there are reports of superior detection of modern threatening stimuli (e.g., syringes, guns, and knives; Blanchette, 2006; Brosch & Sharma, 2005). Furthermore, in some of these studies, results varied with the number of distractors, contrary to the analysis offered by Öhman et al. All of these visual search results and claims are based on adult participants, who presumably have extensive knowledge about snakes and various kinds and degrees of experience with them (Rachman, 2002). However, if humans have an evolved ability to detect threat-relevant stimuli",1.0,3.0
167,"and hence have no particular spatial connotation. Other objects, however, typically occur in particular locations. For instance, branches and clouds are typically overhead, whereas roots and puddles are typically underfoot. Indeed, object words are judged faster when presented on a computer screen in the objects’ canonical locations (Zwaan & Yaxley, 2003). For instance, eagle is judged faster when presented at the top rather than the bottom of a display, whereas snake is judged faster at the bottom (Šetić & Domijan, 2007). Given that many object words encode spatial associations, we hypothesized that an object word directs attention toward the location",1.0,3.0
