paper_id,important_segment,label,Fold_Id
10.1509/jmr.13.0482,"When offered by reward and loyalty programs, in particular, the incentive is often based on the extent of repeat purchasing, unlike other marketing actions such as detailing. Thus, consumers perceive each use and consumption experience as a sequence of related decisions rather than independent transactions, which in turn motivates consumers to invest extended efforts over time (Kivetz and Simonson 2002; Lewis 2004). This suggests that people who have been rewarded before are more likely to engage in similar behavior again, resulting in a positive impact of monetary incentives on purchase (Lichtenstein, Netemeyer, and Burton 1990).",0,6
10.1509/jmr.14.0300,"Zampini, Massimiliano, and Charles Spence (2004), “The Role of Auditory Cues in Modulating the Perceived Crispness and Staleness of Potato Chips,” Journal of Sensory Studies, 19 (5), 347–63. Zhu, Rui, and Joan Meyers-Levy (2005), “Distinguishing Between the Meanings of Music: When Background Music Affects Product Perceptions,” Journal of Marketing Research, 42 (August), 333–45. Copyright of Journal of Marketing Research (JMR) is the property of American Marketing Association and its content may not be copied or emailed to multiple sites or posted to a listserv without the copyright holder's express written permission.",0,6
10.1509/jmr.10.0386,"Specifically, prior work on price perception suggests that price information is associated with multiple meanings that can be conceptualized as either negative or positive (Erickson and Johansson 1985; Lichtenstein, Ridgway, and Netemeyer 1993). On the one hand, price carries a negative meaning when higher prices deter people from buying (Prelec and Loewenstein 1998; Rick, Cryder, and Loewenstein 2008). This occurs when price is viewed as the sacrifice of acquiring desired goods. From this perspective, consumers are encouraged to reduce spending because they understand that current payments limit future utility from foregone options.",0,8
10.1509/jmr.11.0327,"Procedure. As in Study 1, women were asked to make two product choices. Because diamond rings would not be appropriate in the current study (women rarely compare their diamond rings with those of men), one choice in the current study involved a house and another involved a dinner at a restaurant. Again, each choice included two options that presented a trade-off between maximizing absolute gains versus relative gains. Participants were randomly assigned to one of two counterbalanced conditions: their choices involved a comparison with other women (intrasexual rivals) or a comparison with men (potential mates).",0,10
10.1509/jmkr.48.2.403,"The inconsistency between a person’s self-concept and a behavior that violates this self-concept causes psychological discomfort that motivates the person to either change his or her personal attitudes or distort his or her interpretation of the situation (Aronson 1992). Such internal inconsistencies also threaten a person’s self-esteem by making him or her feel inadequate according to essential components of his or her self-concept (Steele 1988; Steele and Liu 1983). For example, consumers who relinquish their freedom to choose experience an internal inconsistency between their view of themselves as free decision makers and their behavior of relinquishing decision control.",0,8
10.1509/jmkr.47.2.361,"In contrast to calculative commitment, affective commitment involves a strong sense of identification, loyalty, affiliation, and obligation. Gustafsson, Johnson, and Roos (2005, p. 211) describe affective commitment as “hotter, or more emotional” than calculative commitment, which is “colder, or more rational.” People develop personal relationships that supplement and reinforce their formal roles (Lawler and Yoon 1998; Ring and Van de Ven 1994). As such, affective commitment also constitutes a motivational influence that favors assimilation of mild levels of supplier misbehavior.",0,5
10.1016/j.cognition.2014.12.009,"Category Correctness (%) Painter Title Artists Easy artist 62 Franz Kline Untitled, 1958 Easy artist 63 Karel Appel Untitled, 1960 Easy artist 63 Sam Francis Tokyo Blue, 1961 Easy artist 65 Elaine de Kooning On the Way to San Remo, 1967 Easy artist 71 Ralph Rosenborg Autumn Landscape, 1974 Easy artist 72 Morris Louis Addition V, 1959 Easy artist 73 James Brooks Boon, 1957 Easy artist 73 Mark Rothko Untitled, 1948 Easy artist 75 Mark Rothko Number 18, 1948 Easy artist 75 Hans Hofmann The Climb, 1960 Easy artist 76 Kenzo Okada Points No.19, 1954 Easy artist 80 Sam Francis",1,8
10.1016/j.cognition.2010.11.002,"We found that the age of peak performance was significantly higher than we would have expected based on previous literature. Fig. 3a shows proportion correct on the CFMT, averaged by the age of our participants. Across all ages, mean proportion correct on this task was 0.81 and the average standard deviation of scores at each age bin was 0.13 (standard deviation of standard deviations across age bins, SD of SD = 0.01). Consistent with previous studies, face recognition increases steeply from the ages of 10 until approximately 20 years.",1,6
10.1111/ajps.12305,"We understand the prior as a beta distribution, which is updated in a series of Bernoulli trials (canvassing attempts). Assuming that upon each solicitation, every success (signature) counts for 1 point and every failure counts for 0, the Bayesian canvasser would update as follows. Suppose that going into a given locale, the canvasser has a prior belief that one-fourth of the people she asks will sign.",1,4
10.1111/ajps.12307,"Further, previous work finds controlled processing to be one of the main coping strategies people use to deal with the unpleasant feelings associated with ambivalence (van Harreveld, Van der Pligt, and de Liver 5Banaji and Heiphetz call implicit/explicit attitude dissociation the “signature result” of research on implicit attitudes (2010, 365). 2009, 52). It follows that ambivalent citizens should draw heavily on explicit attitudes, and less so on implicit attitudes. As for one-sided citizens, they likely have strong and accessible explicit attitudes.",0,8
10.1007/s11747-016-0505-6,"Employees as sources of descriptive norms Service employees’ behaviors affect customers’ moods and behaviors (Tsai and Huang 2002; Van Dolen et al. 2002). As representatives of the service firm, they also influence customers’ perceptions of the firm and embody company norms and values (Schwepker and Hartline 2005). Therefore, customers witnessing negative employee behavior tend to generalize the behavior as typical of the entire firm (Porath et al. 2010) and perceive employee behaviors as seemingly appropriate conduct in that servicescape (Yi and Gong 2008). Negative behavior then might spill over from the employee to the customer.",1,5
10.1037/a0022151,"As noted above, there was a Violence Endorsement Prime interaction among the honor group, such that the prime shifting the cultural ideal made those more endorsing of violence become relatively more honest and those less endorsing of violence become relatively less honest. The prime was particularly effective among honor group members most steeped in the culture-of-honor ethos.",0,2
10.1037/a0019628,"Building on this analysis, Beach, Fincham, Hurt, McNair, and Stanley (2008) offered a conceptual framework in which they argued that prayer for a relationship partner can function in ways that are consistent with the aims of traditional skills-based interventions with couples. That is, when implemented in the context of conflict, prayer can function as a time out, a commonly used procedure in skills-based couple interventions. In this context, prayer provides a time during which the partner can self-sooth and during which cooperative goals can regain their dominance, replacing revenge-oriented or competition-oriented motives.",0,9
10.1037/a0017452,"Overview of the Present Studies In four studies, we tested whether chronic self-views influence performance evaluation because they influence the perceptions and interpretations of the bottom-up experience people have with the task. Study 1 explored this analysis by varying the timing of when participants learned that a certain skill (e.g., computer programming) was supposedly relevant to the task at hand. We hypothesized that if participants learned about the skill before beginning the task, then their self-beliefs of skill would color bottom-up experiences and, thus, influence performance estimates.",0,7
10.1111/jomf.12438,"Although parenting strain has been identified as a key factor in parental and child well-being, surprisingly little is known about what influences it. One important theory used to understand parenting strain is family stress theory (K. J. Conger, Rueter, & Conger, 2000; R. D. Conger et al., 2002), which posits that the principal mechanism through which contextual stressors negatively influence parenting is parental psychological stress (K. J. Conger et al., 2000; R. D. Conger et al., 2002). In other words, exposure to contextual stressors contributes to increased parental psychological stress, which then reduces positive parenting.",0,3
10.1111/j.1741-3737.2010.00701.x,"One possible explanation for this counterintuitive finding is that mothers experience higher levels of stress than fathers when their child displays externalizing problems, which then leads to lower levels of support of these mothers (Baker & Heller, 1996). In addition to these increased stress levels, mothers might also feel more need for assistance in dealing with their child (Baker & Heller).",0,6
10.1177/0956797614557867,"However, the tweets of younger adults may disclose characteristics of their community, reflecting a shared economic, physical, and psychological environment. At the individual level, psychological variables and heart-disease risk are connected through multiple pathways, including health behaviors, social relationships, situation selection, and physiological reactivity (Friedman & Kern, 2014). These pathways occur within a broader social context that directly and indirectly influences an individual’s life experiences. Local communities create physical and social environments that influence the behaviors, stress experiences, and health of their residents (Diez Roux & Mair, 2010; Lochner, Kawachi, Brennan, & Buka, 2003).",0,7
10.1177/0956797610380697,"Such an interaction between bimodal and unimodal information may increase the efficiency with which people are able to carry out goal-directed actions such as grasping. For example, in a case in which the perceptual segregation of objects would be demanding if based solely on image-based cues (e.g., grabbing a book from a cluttered table), bimodal representations might supplement the unimodal representation of objects near the hand in order to efficiently segregate them from their backgrounds.",0,9
10.1111/j.1745-9125.2011.00255.x,His research focuses on the role of threat perceptions and race-related attitudes as predictors of support for various social control measures. His dissertation examines whether the racial typification of delinquency helps to account for sentiments related to juvenile justice policy. Ted Chiricos is the William Julius Wilson Professor of Criminology and Criminal Justice at Florida State University. His current research interests include the effects of race and social threat on justice outcomes as well as on the various factors that contribute to the extraordinary punitiveness of American culture.,0,9
10.1509/jmr.13.0244,"Keywords: self-signaling, charitable donation, context effects, prosocial behavior, choice Giving Against the Odds: When Tempting Alternatives Increase Willingness to Donate © 2015, American Marketing Association ISSN: 0022-2437 (print), 1547-7193 (electronic) 27 Most consumer research has treated choice as the pursuit of consumption-related goals. However, motives for choice often extend beyond the consumption benefits associated with a chosen option (Ariely and Norton 2009; Levy 1959; Mick 1986). For example, consumers may derive reputational benefits from the information certain choices convey about themselves to others (Berger and Heath 2007; Griskevicius et al. 2007).",0,1
10.1509/jmr.10.0083,"From this literature, the tendency of observers to focus on abstract, dispositional information, an effect typically found in Western cultures in which people have a propensity for a chronic independent self-construal, dissipates among Easterners, who tend to have a chronic interdependent selfconstrual (e.g., Masuda and Kitayama 2004; Miyamoto and Kitayama 2002). Instead, Eastern observers are more likely to consider concrete, situational factors when rendering judgments about others. The participant role. By the same token, when interdependents are actors themselves, they are disposed to engage in perspective taking and render observer-like judgments.",0,9
10.1509/jmkr.48.3.425,"In the network on the left, actor 1 interconnects the pairs of not-related actors (2, 4) and (3, 4) but not (2, 3), because actors 2 and 3 are related in that network. Because actor 1 is the intermediary of the only two-step path between actors (2, 4) and (3, 4), B(v) in Equation 3 becomes actor 2. In the same figure, on the right-hand side, actor 1 interconnects the same two pairs of not-related actors.",1,7
10.1016/j.cognition.2016.01.016,"Bilinguals’ task-switching abilities have been studied by using a typical task-switching paradigm that considers both switch costs and mixing costs, which have been found to implicate different control mechanisms (Braver, Reynolds, & Donaldson, 2003). Specifically, switch costs—i.e., the actual cost of switching between different task sets—arise from local control mechanisms that involve transient task-set reconfiguration (Rogers & Monsell, 1995) and proactive interference from previous task sets (Wylie & Allport, 2000). Mixing costs—i.e., the cost of monitoring and coordinating multiple streams of incoming information—entail activation of global and sustained control mechanisms (Rubin & Meiran, 2005).",0,7
10.1016/j.cognition.2013.11.008,"A model of self-inhibitory neural circuits has been proposed to explain negative compatibility effects on motor performance (Eimer & Schlaghecken, 2003), based on recordings of the lateralized readiness potential (LRP) in conjunction with behavioural measures of motor efficiency (Eimer & Schlaghecken, 1998). According to this model, an initial facilitation of the correct motor response automatically turns into inhibition of the correct response when primes and targets are further separated in time (but see Jaśkowski, 2008).",0,8
10.1016/j.cognition.2013.09.009,"In Experiment 1, the small target was worth 100 points, the large target was worth 50 points and the background was worth 25 points. In Experiment 2, the reward associated with the large target was raised to 75 points, an alteration that should pose no problems for an optimal participant. Throughout the experiment, the participant’s cumulative score was displayed above the dock in blue numerals (Panel B–F, Fig. 3, – exemplified here by ‘‘175’’ and ‘‘275’’). Participants initiated each trial by touching the dock with the stylus (Panel B), whereupon one of the unique stimulus configurations was displayed.",0,10
10.1016/j.cognition.2013.07.003,"We utilized a paradigm of temporal statistical learning wherein individual items are grouped into sequences of fixed sequential order, and these groups are in turn presented repeatedly in a randomized order (Fiser & Aslin, 2002; Kim et al., 2009; Turk-Browne et al., 2005). In this paradigm, each item has a particular degree of temporal predictability according to its position within its group. For instance, an item that appears early in a given group is less predictable than an item that appears later in that group.",0,7
10.1016/j.cognition.2010.10.002,"Critical for our purpose is that if SWS sounds are combined with lipread information, then naïve subjects in non-speech mode show no or only negligible intersensory integration when asked to identify the sound, while subjects who learned to perceive the same auditory stimuli as speech do integrate the auditory and visual stimuli in a manner similar to natural speech (Tuomainen, Andersen, Tiippana, & Sams, 2005; Vroomen & Baart, 2009).",0,9
10.1016/j.cognition.2010.05.005,"This would predict that children should work out the spatial meanings of words before temporal meanings. Of course, Conceptual Metaphor theory would predict the same: on that view, the acquisition of concrete before abstract language reflects the ongoing construction of metaphoric links in conceptual structure. On the present account, it would merely reflect a strategy for mapping words to pre-existing, abstract concepts.",0,2
10.1016/j.cognition.2009.07.013,"All testing was done by two experimenters in a quiet separate room of children’s daycare centres. At the beginning of each session, the first experimenter (E1) introduced the child to two hand puppets (a cow and an elephant). The puppets were located in a cardboard toy house, each in a separate room, facing the child and separated from each other by a wall. The house was built on stilts so that there was a space below the rooms of the puppets which the child – but not the puppets – could see and reach.",0,9
10.1111/ajps.12284,"Districts subject to preclearance coverage are shown with diamonds, and districts that were not subject to coverage are shown with circles. The vertical bars are the 95% confidence intervals, and the hash marks along the x-axis show the distribution of the Black percentage of the population across districts. Across all values along the x-axis, legislators’ support for civil rights legislation differed significantly depending on whether the district was subject to coverage under Section 5. However, among districts with larger Black populations, the effect of VRA coverage increased dramatically.",1,6
10.1111/ajps.12195,"If the acquisition of socioeconomic resources translate into political knowledge, interest, efficacy, and participation among individual women, then residing in a context in which women collectively have more resources should translate into growing up around, and recurrently coming into contact with, women who are more politically empowered and engaged. Symbolically, the collective resources of women could influence individual women through the psychological benefit experienced by members of marginalized groups from seeing members of their group socioeconomically thriving and in positions of power and authority.",0,5
10.1111/ajps.12152,"Recent evidence on congressional “taunting” fits precisely this pattern; representatives from safe seats are especially likely to taunt the opposition party. Congressional press releases that fit the partisan taunting category—meaning that they utilize “exaggerated language to put [the opposition] down or devalue their ideas”—make up more than one-quarter of all congressional press releases issued between 2005 and 2007 (Grimmer and King 2011, 2649). The level of animosity across party lines also implies a reduced willingness to treat the actions of partisan opponents as legitimate, resulting in more intense contestation of policy outcomes.",1,2
10.1111/ajps.12074,"Two episodes from India’s state reorganization illustrate the connection between the government’s domestic political considerations and the probability of violence: the Bombay City controversy and the movement to split Bihar. The interests at odds over Bombay City—Marathis and Gujaratis—were both important voting blocs. New Delhi initially backed the demands of Gujaratis, a somewhat stronger Congress constituency. However, it reversed course when Marathi violence created national outcry. By contrast, tribals seeking to leave Bihar were much weaker within Congress than Biharis. Tribals were discouraged from mobilization by pessimism regarding the central government’s likely response.",0,8
10.1111/j.1540-5907.2011.00517.x,"In contrast, members who represent districts that are safely Democratic (or Republican), and thus where the challenge is more likely to come in a primary election, may engage in partisan behavior in an attempt to shore up support from strong partisans, who make up a larger portion of the primary electorate (Geer 1988; Grofman 1993; Norrander 1989). While competitive primary and general elections are not mutually exclusive, we can think of members as focusing on gaining support from specific reelection constituencies, which will be related to where they anticipate challengers.",1,2
10.1111/j.1540-5907.2009.00384.x,"The hybrid regimes literature has often been treated apart from its forerunner in the “old authoritarianism,” but this finding suggests a resonance between Levitsky and Way’s category and seminal works on democratic transitions and polyarchy. Years ago Dankwart Rustow posited that democracy began in nationally unified polities that experienced a “long and inconclusive struggle,” “a hot family feud” (1970, 352, 355). Writing in the same period, Robert Dahl argued that governments were more likely to become democratic as the opposition gained in strength and inclusion outweighed repression as a political tactic (1971, 16).",0,9
10.1086/676661,"Evidence from earnings profiles thus suggests that ðaÞ threshold-crossing is associated with early earnings losses and later earnings gains, but that ðbÞ the gains are larger than the losses. I return to this point when discussing internal rates of return in Section V.D. Figure 8 shows the effect of threshold crossing on quarterly earnings, measured in 2005 dollars. Threshold-crossing raises mean quarterly earnings by $372. This is a 5.1% gain over expected earnings just below the threshold, which are equal to $7,241.",0,3
10.1007/s11747-015-0425-x,"Furthermore, customer orientation provides salespeople with profound customer knowledge, a form of resource slack, that relieves ambidextrous salespeople from the mental and physical constraints of engaging with both new and existing customers (c.f., Kyriakopoulos and Moorman 2004; Voss et al. 2008). Conversely, when salespeople experience an imbalance among the three orientations, we expect their performance will suffer for at least two reasons. First, low customer-oriented salespeople will experience greater physical and mental constraints because they lack the skills to effectively perform either hunting or farming activities.",0,5
10.1037/a0031050,"Accurately expressing extraversion can be useful for social functioning but is valued differently across cultures (Searle & Ward, 1990). Thus, while it is useful to know whether others are introverted or extraverted, there is not necessarily universal, evolutionary value in trying to pass as extraverted or introverted, as is thought to be the case for trustworthiness (Cosmides, 1989).",1,10
10.1111/jomf.12319,"Amato (2000) centered on the resources for coping with stress in order to demonstrate how some families cope with post-divorce stress and how other families do not. According to the divorce–stress–adaptation perspective, adults and children experience one of two different processes of adjustment subsequently after divorce: the short-term crisis model and the chronic strain model (Amato, 2000). With the short-term crisis model, post-divorce stress is relatively brief, with adults and children returning to pre-divorce stress levels. For this model, divorce is a temporary crisis that impedes well-being only in the short term.",1,6
10.1111/jomf.12336,"The criteria partners use to evaluate whether the additional partner is a valuable investment for the household is similar to Lamb’s three-part taxonomy to father involvement: parental engagement (i.e., direct interaction with the child), availability (i.e., accessibility to the child), and responsibility (e.g., financial support; Lamb, 1986). Thus, when partners are viewed as crucially lacking responsibility or resources across the three areas, couples may choose to dissolve their union. If there are doubts among couples who separated, that is when relationships are negotiated and reforming of relationships may occur (Dailey et al., 2012).",0,5
10.1111/jomf.12036,"Involvement in these more indirect activities may make the child feel more comfortable in the presence of the father. Conversely, and contrary to initial conjecture, higher levels of Factor 2 (ease of father – adolescent communication) were associated with lower RSA and greater RSA withdrawal (lower RSA-R), indicating a less relaxed state of the child. Thus, when fathers make it easy for children to talk to them the adolescent may orient more toward the father and prepare to engage in an active exchange (i.e., vagal withdrawal).",0,4
10.1111/j.1741-3737.2012.01034.x,"Physical and mental health are closely tied to sexual activity. Specific physical illnesses have been associated with incidence of sexual activity or sexual dysfunction (e.g., erectile dysfunction), including cardiovascular disease, hypertension, diabetes, obesity, cancer, and lower urinary tract symptoms and prostate disease in men (DeLamater & Sill, 2005; Lindau et al., 2007; Rosen, Wing, Schneider, & Gendrano, 2005). In addition, because sexual activity is physical activity, conditions such as arthritis (Lindau et al.) and obesity (Rosen et al.) can compromise functional health, which reflects an individual’s ability to perform daily tasks.",1,1
