paper_id,important_segment,label,Fold_Id
10.1016/j.obhdp.2010.02.001,"Individuals with high meta-cognitive CQ engage in higherorder cognitive processes when trying to adapt to new cultures, including how to plan learning about the new culture as well as evaluating and monitoring their own progress. Cognitive CQ refers to an individual’s acquired knowledge of similarities and differences regarding norms, practices, and conventions of other cultures (Ang & Van Dyne, 2008). Motivational CQ refers to an individual’s ability to direct attention and energy toward adapting to new cultures. More specifically, motivational CQ refers to intrinsic motivation and self-efficacy in adapting to new cultures.",0,8
10.1086/681715,"Lestel, L., M. Meybeck, and D. R. Thévenot. 2007. “Metal Contamination Budget at the River Basin Scale: An Original Flux-Flow Analysis (F2A) for the Seine River.” Hydrology and Earth System Sciences 11:1771–81. Levine, Adeline Gordon. 1982. Love Canal: Science, Politics and People. Lexington, Mass. : D.C. Heath and Company. Litt, Jill S., and Thomas A. Burke. 2002. “Uncovering the Historic Environmental Hazards of Urban Brownfields.” Journal of Urban Health-Bulletin of the New York Academy of Medicine 79: 464–81. Logan, John R., and Harvey L. Molotch. 1987.Urban Fortunes: The Political Economy of Place. Berkeley and Los Angeles: University of California Press.",1,10
10.1086/682418,"378 participants. In each producer organization, group members were randomly assigned to one of three variants of the PGG. In the baseline condition, subjects participated in six rounds of a PGGwithout punishment or communication. In the second condition, after two preliminary rounds of play, one of the participants was elected to become a monitor endowed with sanctioning power. Namely, monitors were able to spend 1MU to take away 3 MUs from subjects whose contribution level they disapproved.27 In the third condition, after two preliminary rounds of play, players were allowed to publicly discuss their strategy for three minutes.",1,1
10.1093/qje/qjv013,"Experimental evaluations of school voucher programs to date typically feature excess demand for a limited number of vouchers, which are allocated among applicants by lottery. Such a design creates four groups of students as shown in Figure I (Panel A): non-applicants (group 1), applicants who lose the lottery (group 2), applicants who win (group 3), and students in private schools to begin with (group 4).",1,3
10.1007/s13524-016-0487-5,"It may be argued that for the purpose of studying spatial inequality, it doesn’t matter that sorting occurs mainly at the scale of street segments rather than larger units. As noted earlier, Suttles (1972) believed that larger areas constituted what he called “defended neighborhoods” in which one could expect to find collective mobilization. It is at these larger scales that school segregation and other public infrastructure are often determined, and for some purposes, the “real” boundaries of neighborhoods are predetermined by service boundaries or electoral boundaries or other similar sharp dividing lines.",1,4
10.1037/a0024182,"This theoretical contrast ( 1, 1, 2) based on the proportions from the imputed dataset was significant (z 2.141, p .032 two-tailed, .016 one-tailed) as it was when the same contrast was conducted on those who had responded (z 2.148, p .031 two-tailed, .015 one-tailed). Thus compared to both comparison conditions, the AR condition resulted in a greater proportion of registrations.",0,2
10.1002/per.815,"Significant gender-related differences were also detected in three of the Big Five traits, with women scoring higher than men for Neuroticism (t ¼ 7.53, 572 df, p < .001; d ¼ 0.62), Openness (t ¼ 2.06, 572 df, p < .05; d ¼ 0.17) and Agreeableness (t ¼ 6.67, 572 df, p < .001; d ¼ 0.35). With regard to the measures of SWB, significant differences were obtained in negative affect, with women scoring higher than men (t ¼ 4.23, 569 df, p < .001; d ¼ 0.35). The variables considered were also significantly related to age.",1,5
10.1016/j.obhdp.2010.10.001,"Given that greed is often associated with immorality (Shaw, 2009; Sherman & Clore, 2009), actors may also see the act of dishonesty as more ethical than when they alone benefit. They may rationalize that their dishonesty helps others and therefore is both less greedy and less unethical than if they alone were to benefit from it. People often perceive allocations that differ significantly from 50–50 as unfair when there are no justifications for other allocations (e.g., Güth, Schmittberger, & Schwarze, 1982). As such, different splits of the spoils may be more or less likely to lead to such unethical behavior.",0,1
10.1016/j.obhdp.2009.06.003,"Interaction of social uncertainty and outcome prospects Increasing social uncertainty should minimize the effects of loss prospects on the likelihood of contribution. This hypothesis is based on the observation that individuals in social dilemmas follow basic decision rules or ‘‘choice heuristics”: they first ask themselves whether the group is capable of achieving the public good; e.g., will we attain the provision threshold (Messick & Rutte, 1992, p. 106).",0,8
10.1016/j.obhdp.2009.05.005,"Because high-level construals reduce the impact of the affective goals, people with high-level construals who nevertheless seek information must have a genuine desire to learn or benefit from the information. This information can add to the existing central goal (e.g., having good memories of the wedding), but the search is not motivated by the need to undo irritating uncertainty. In contrast, low-level construals can lead to a strong desire to undo irritating uncertainty (e.g., finding out whether one was overcharged), because then the secondary, peripheral features of such events and the corresponding affective goal become more important.",0,8
10.1016/j.obhdp.2008.11.001,"According to the experimenter, pilot investigations had revealed that the translation of 45 texts represented a manageable task for the department. Fees would be performance-related: they would depend on the number of texts decoded by the department. Additionally, the best two departments would receive a special bonus amounting to 100 Euro (about 90 US $). The participants were then asked into separate rooms. The subsequent procedure depended on which condition of the choice status factor was being implemented. In the responsibility condition, participants were allotted the role of the department head.",1,6
10.1016/j.obhdp.2008.07.003,"When uncertainty exists (e.g., unknown performance standards, inconsistent procedures), employees and organizations are likely to have divergent understandings of what and how much is owed to each other (Robinson & Brown, 2004). As mentioned previously, incongruence between two parties is a primary antecedent of psychological contract breach (Robinson & Morrison, 1997). When procedural fairness is high though, the decision-making process is transparent, consistent, and understood by employees (Cropanzano et al., 2002; Folger & Bies, 1989). High procedural justice therefore reduces perceptions of contract breach because it promotes congruence between employees’ and organization’s beliefs about their obligations.",0,4
10.1177/0003122418785371,"The result is that even though more college-educated individuals are being squeezed into less-skilled work, the large gains made by workers at the top of the occupational pyramid can counterbalance and sometimes outweigh the losses of those who cannot find work appropriate for their skills. At the same time, college-educated individuals who cannot find skilled work have fewer palatable options. There are fewer middle-class and middle-skilled jobs today compared with low-skilled service jobs (Kalleberg 2011), meaning that college-educated workers who cannot find skilled jobs are likely to find menial service jobs instead.",1,2
10.1177/0003122415622391,"STAR involved eight hours of participatory training sessions that encouraged teams and managers to identify new work practices and processes that would increase employees’ control over their work time and focus on key results (rather than simply face time at work). For example, there were extensive discussions concerning communicating by instant messenger, coordinating more efficiently with offshore staff, and better anticipating and handling periods of high demands, such as around software releases.",0,6
10.1177/0003122412448050,"The heterosexual male partnership rate also peaked for men in their late 30s, but unlike the female partnership rate, the male partnership rate remained high (around 80 percent) as men aged (see the upper-right quadrant of Figure 2). The rate of Internet use for meeting partners peaked for women in their early 40s and then declined. Women’s rate of using the Internet to meet men roughly paralleled men’s partnership rate up to about age 50, when women’s use of the Internet to meet men declined, but the men’s partnership rate remained high.",1,7
10.1177/000312240907400508,"And now until July 31st, any SYSTAT site or network license order will come with a free one-year maintenance contract. Call 877-797-8280, or visit: www.systat.com/asa today. Edited by Alan Sica Bimonthly ISSN 0094-3061 Contemporary Sociology, the ASA journal of reviews, provides readers access to the most signifi cant books recently published by sociologists and related social scientists. Contemporary Sociology is a valuable guide for keeping scholars informed of the work done by and for sociologists. Major controversies or new areas of inquiry in sociology are brought to the reader’s attention with featured review essays or symposium reviews in each issue.",0,6
10.3102/0002831214549452,"Therefore, to be able to maintain high cognitive demand levels of tasks, teachers need to closely attend to and make sense of students’ thinking when students are working on these tasks as well as monitor their own actions that are critical for facilitating students’ high-level thinking about the disciplinary ideas and practices embedded in the task.",1,7
10.3102/0002831214532515,"The second most common attractor state for the upward group (teacher ‘‘pulling’’ students) represents ‘‘constructive friction,’’ or teacher challenges for students to increase the quality or frequency of their activity if they are not inclined to do so on their own (Vermunt & Verloop, 1999). In this case, the teacher must meet students in their ‘‘motivational zone of proximal development’’ and scaffold their value or appreciation for the opportunity being offered (Brophy, 1999, p. 77).",0,7
10.3102/0002831209348970,"This would mean that the White teacher would have a passing combined score of 325 (standardized to 20.24) while the Black teacher would have a failing score of 304 (standardized to 21.20). We propose a class of 19 students total, comprising 5 White students (26%), 11 Black students (58%), and 3 other-race students (16%).21 Using the estimates reported previously in Table 5, we predict student outcomes in this hypothetical classroom, holding all else equal.",1,6
10.1177/0014402918771337,"The shading indicates that the relationship between the odds identification of autism for the race associated with the map (e.g., Latino) to the odds of identification of the WH group within the state. For example, Figure 1 shows that Illinois is shaded dark grey for the AI-AN group. This means the odds in Illinois of being identified as having autism for AI-AN is significantly higher (p < .05) than the odds for the WH group in Illinois.",1,4
10.1037/a0034806,"Unhealthy behavior, such as nonadherence to treatment, physical inactivity, an unhealthy diet, and smoking might also explain part of the association. Anxiety is related to an unhealthy lifestyle in individuals at risk of CHD (Bonnet et al., 2005), and with lower adherence to various risk reducing recommendations in patients following an acute cardiac event (Benninghoven et al., 2006; Kuhl, Fauerbach, Bush, & Ziegelstein, 2009). An avoidant coping strategy is a maladaptive way of downregulating anxiety that might lead to a decline in cardiac health behavior among anxious post-MI patients (Benninghoven et al., 2006).",0,7
10.1007/s10979-008-9167-3,"Entering age, prior charges, and the PCL:SV total score at Block 1 and the PICTS GCT score at Block 2 of a Cox regression analysis of serious recidivism (more serious charges) revealed significant effects at Blocks 1 (v2 (3) = 13.88, p \ .01) and 2 (v2 (1) = 4.49, p \ .05). When age, prior charges, and the PICTS GCT score were entered at Block 1 and the PCL:SV total score was entered at Block 2, Block 1 was significant (v2 (3) = 17.32, p \ .001) but Block 2 was not (v2 (1) = 1.05, p = .31).",0,8
10.1111/1745-9125.12105,"We suggest expanding the thinking about unstructured socializing and other routine activities by acknowledging that (leisure) activities are situations that provide opportunities for delinquency (or positive behavior) and, at the same time, form a social context for such behavior. We argue that the situations in which adolescents spent their leisure form a behavior setting (Barker, 1968) and should be further investigated as such. Behavior settings are “extra-individual units with great coercive power over the behavior that occurs within them” (Barker, 1968: 17).",0,5
10.1177/0003122416663683,"Chapel Hill: University of North Carolina Press. Zerubavel, Eviatar. 1997. Social Mindscapes: An Invitation to Cognitive Sociology. Cambridge, MA: Harvard University Press. Bart Bonikowski is Associate Professor of Sociology at Harvard University. His research applies insights from cultural sociology to the study of politics, including the diffusion of attitudes across political networks, nationalism in established nation-states, and populist claimsmaking in electoral and legislative discourse. Paul DiMaggio is Professor of Sociology at New York University. He has studied cultural contention in the United States and is currently exploring the applicability of computational text analysis to the study of cultural change.",1,9
10.1086/691128,"For example, two two-dimensional work-family sequences of persons A and B can be denoted as follows: Trajectories over the Life Course 1459 Age 22 23 24 25 26 Person A [SNC, EDU] [SNC, EDU] [SNC, EDU] [SNC, EDU] [SNC, EDU] Person B [SNC, EDU] [PNC, OLF] [P1C, FAM] [P2C, FAM] [P3C, FAM] The row for person A shows a sequence in which a person is single with no child (SNC) and in education (EDU) during the entire example age window from 22 to 26.",1,1
10.1086/669507,"1282 Vincent, R. J. 1986.Human Rights and International Relations. Cambridge: Cambridge University Press. World Christian Database. 2008. Countries and Regions. http://www.worldchristiandata base.org/wcd/about/country.asp. Wronka, Joseph. 1998. Human Rights and Social Policy in the 21st Century: A History of the Idea of Human Rights and Comparison of the United Nations Universal Declaration of Human Rights with United States Federal and State Constitutions. Langham, Md. : University Press of America. Zimring, Franklin E. 2003. The Contradictions of American Capital Punishment. Oxford: Oxford University Press.",1,5
10.3102/0002831208323278,"Richardson and Skinner (1990), for example, concluded in their study of nine 4-year institutions that the coordination of a wide variety of strategies is more critical than the implementation of a particular program or policy for determining the success of how institutions adapt successfully to diversity. According to Chang (2002), campus diversity efforts should move beyond striving toward superficial changes and seek to transform the normative context by addressing deeply held institutional values and practices.",1,2
10.1177/0014402915625067,"Next, students independently generate a brief main idea statement, share with group members, and give one another feedback (get the gist). After reading the entire text, students ask and answer each other’s questions; write a short review statement; and discuss why their ideas are the most important, using evidence from the text (wrap up). Initially, teachers use explicit instruction to introduce each strategy one at a time over about five or six short lessons.",0,3
10.1007/s13524-016-0512-8,"A recent review of evidence regarding patterns of marital behavior suggests that couples are still quite interdependent units (Lauer and Yodanis 2011; Yodanis and Lauer 2014). Despite definite changes in marriage in the direction of individualization, the percentage of couples who share bank accounts, residences, and time remains high (Lauer and Yodanis 2011). The individualization of marriage argument is also undermined by research showing that individuals want to spend more time with their spouses (i.e., Bianchi 2009; Bianchi et al. 2006; Nomaguchi et al. 2005; Roxburgh 2006).",1,8
10.1007/s13524-011-0041-4,"Acknowledgments The research reported here was supported in part by the Wisconsin Department of Children and Families and the Institute for Research on Poverty; any views expressed are those of the authors and not necessarily those of the sponsoring institutions. A previous version of this article was presented at the 2009 annual meeting of the Population Association of America, and at the 2009 annual meeting of the Association for Public Policy Analysis and Management.",1,6
10.1037/hea0000355,"Psychological resources, such as purpose in life, self-esteem, optimism, and positive affect, are associated with salubrious health outcomes, including lower rates of disease and increased longevity as well as more favorable profiles of biological risk factors (Boehm & Kubzansky, 2012; Boylan & Ryff, 2015; Chida & Steptoe, 2008; Kim, Park, Sun, Smith, & Peterson, 2014; Kim, Strecher, & Ryff, 2014; Kim, Sun, Park, Kubzansky, & Peterson, 2013; Kim, Sun, Park, & Peterson, 2013; Pressman & Cohen, 2005).",0,1
10.1093/jopart/muy006,"The internal stakeholders, such as employees and managers, have unique advantages in assessing performance because they gain substantial information about their programs during implementation (Andrews et al. 2006). Unlike external stakeholders who can only observe current service outcomes, internal stakeholders can access the service production process, organizational capacity, or the potential of improving the service quality. They may consider these things when assessing performance and not just the current impact services have. Internal stakeholders have the potential, therefore, to understand the service delivery process better and evaluate performance more accurately than outsiders.",1,9
10.1093/jopart/muv016,Hospitals Without Corporatization Hospitals With Corporatization t Test p Value Kolmogorov-Smirnov Test p Value Mean leased beds Before genetic matching 0.093 0.064 .012 .016 After genetic matching 0.048 0.064 .049 .028 PubLD Before genetic matching 0.675 0.934 .000 — After genetic matching 0.934 0.934 1.000 — Pscore Before genetic matching 0.148 0.278 < .001 < .001 After genetic matching 0.275 0.278 .181 .863 Year 2003 Before genetic matching 0.161 0.289 .004 — After genetic matching 0.322 0.289 .528 — Year 2004 Before genetic matching 0.149 0.298 .001 — After genetic matching 0.298 0.298 1.000 — Year 2005 Before genetic matching,0,1
10.1037/ccp0000326,"Treatment gains were maintained at 2-year follow-up because the posttreatment rates of remission were relatively stable at 2-year follow-up assessment (see Table 3 for categorical and Table 5 for continuous outcomes). Table 6 presents the proportion of participants who continued to be in remission, relapse, and new remission at follow-up assessment compared to the posttreatment assessment. Few children had relapsed by the 2-year follow-up assessment (ICBT 6%, 95% CI [01,12], and GCBT 4%, 95% CI [00, 9], for primary anxiety diagnosis).",1,8
10.1037/ccp0000114,"The patients had no individual sessions except for the intake session. The first week consisted of education about the specific therapy model (CT or GMT), the patients setting specific goals for their treatment, and removal of any remaining psychotropic medication. In Weeks 2 to 4, the specific therapy model (CT or GMT) was intensely implemented. In the fifth week, the patients returned home to test their newly acquired skills in their natural environments.",0,6
10.1037/a0033536,"In particular, behaviors that are legal and widely accessible for teens may T hi s do cu m en t is co py ri gh te d by th e A m er ic an Ps yc ho lo gi ca l A ss oc ia tio n or on e of its al lie d pu bl is he rs .",0,2
10.1037/a0021227,"Cross-contamination between the two orientation conditions was considered a potential threat to internal validity, and so the agency agreed that their therapists would deliver one orientation condition or the other but not both. SM materials and training were not shared with SAU therapists until after the study was completed. PCIT parenting condition. The PCIT parenting condition followed the same protocol used in the Chaffin et al. (2004) laboratory study (designed dose 12–14 sessions; mean received dose 10.1 sessions, SD 3.6). In PCIT, parents learn a specific behavioral skill set during two sequential program phases.",0,9
10.1037/a0023821,"If higher alliance in the MG group early in treatment partly reflected the enhanced clarity of manualized treatment procedures, then group differences on that dimension might diminish over time as UC youths get to know their therapists and learn what to expect in therapy. This might well lead to increased alliance over time in the UC condition. By contrast, the structure and expectations (e.g., role plays, homework assignments) associated with manuals might lose some of their appeal over time, given their association with the “work” of therapy.",0,10
10.1007/s13524-018-0707-2,"We thank NCHS for providing a special-request version of the NHIS-LMF data. The research in this article was conducted in the Missouri Federal Statistical Research Data Center (RDC) in Columbia, Missouri, and Triangle RDC in Durham, North Carolina, while the first author was a Special Sworn Status researcher of the U.S. Census Bureau at the Center for Economic Studies. The content of this article is the sole responsibility of the authors and does not necessarily represent the official views of the U.S. Census Bureau, NCHS, NIA, NICHD, or the National Institutes of Health.",1,9
10.1093/jopart/muw056,"Our results indicated that PSM–career success relationships were stronger in Germanic European as compared to Anglo nations. Contest-mobility perspectives to career success suggest that those who are making the greatest contributions to their organizations will rise through the ranks (Ng et al., 2005). Workers perform their jobs better when the work environment provides opportunities for motivation fulfillment. As described in the theory of purposeful work, task-specific motivation processes are triggered when personal motivations and job characteristics align, leading to superior work performance (Barrick, Mount, and Li 2013).",1,3
10.1016/j.jbusres.2015.12.065,"As most online channels provide an explicit and clear option to pay with LP points at checkout, this interface can induce member customers to use their LP points when making transactions. Therefore, stores that prefer to change their member customers' point redemption behavior in offline channels can provide an informative interface through which member customers can easily redeem their points. For instance, member stores may educate their sales persons or cashiers to inform member customers about the amount of available LP points that can be used.",1,4
10.3102/0002831212473349,"The structured interventions to promote reasoning strategies in the present study involved minimally guided and implicit discovery learning in that children actively determined sums, reconsidered answers in the face of feedback regarding correctness only, and detected a mathematical regularity and used this regularity to construct strategies for themselves. In an effort to move beyond passive learning activities (Chi, 2009) and consistent with the generation effect (Alfieri et al., 2011) and the recommendation of the NMAP (2008), structured training involved sequentially arranging problems to highlight a relation and where that relation was applicable.",0,1
10.3102/0002831211402663,"The figure shows variation in principals’ ratings across individual items within and across the factors. On average, principals felt the most effective at developing relationships with students, communicating with parents, attending school activities, developing safe school environments, dealing with concerns from staff, managing school schedules, and using data to inform instruction. Principals felt least effective at fund-raising, planning professional development for prospective principals, releasing or counseling out teachers, utilizing district office communications to enhance their goals, and working with local community members and organizations.",0,7
10.1016/j.leaqua.2014.12.005,"In addition to bringing reproductive advantages to the group, leaders are also likely to reap the benefits of occupying leadership roles by enhancing their own chances of survival and reproduction (van Vugt, 2006). Group leaders are typically considered to possess high levels of initiative, “assertiveness”, “vision”, and “persistence” (van Vugt, 2006; van Vugt et al., 2008, p. 192). They “plan ahead”, “anticipate new dangers”, take proactive measures to deal with potential threats, and persevere until achieving their goals (van Vugt et al., 2008, p. 184).",0,9
