paper_id,important_segment,label,Fold_Id
10.1016/j.jesp.2018.06.002,"This may explain why the government, the news media, and the public relish in seeing CEOs lambasted in court (e.g., The New York Times Editorial Board, 2016) and are often unwilling to let corporations off the hook until senior executives leave in disgrace (Thompson & 6 7 Liakos, 2015). Given people's desire to satisfy short-term desires over long-term goals (e.g., Baumeister, 2002) and that people punish for retributive reasons (Carlsmith et al., 2002), they may end up extracting suffering from a series of CEOs at the expense of dedicating the limited amount of resources to fixing the underlying problem.",0,4
10.1016/j.jesp.2017.11.013,"The experiment was conducted in the Social Immersion Lab in the Psychology Department at the University of St Andrews. Prior to the experiment it was confirmed that participants did not know each other in any way. Participants arrived at the lab at the same time and were given instructions before any social chatting could take place. Participants were given information forms describing the experiment and then asked to complete a consent form. As the minimal group paradigm, participants were told the cover story that the experiment was designed to study the link between cognitive style and social interaction.",0,8
10.1016/j.jesp.2017.06.015,"They are also told that they will be assigned a “reputation score” by their partner, and that this game will repeat multiple times. In economic games similar to this (e.g., Dictator Game, Prisoner's Dilemma, Ultimatum Game; Balliet et al., 2014; Kramer & Brewer, 1984; Yamagishi &Mifune, 2008), individuals tend to demonstrate an ingroup bias whereby they allocate more resources to members of their own group than to the outgroup.",0,8
10.1016/j.jesp.2017.07.008,"In the case of political conspiracies, they also provide a means for engaging in protest against perceived abuses of governmental power. This protest allows a greater sense of personal empowerment against larger political-social forces (Bost & Prunier, 2013). For these reasons, conspiratorial thinking taps into a natural protection mechanism against potential threats. However, what constitutes a threat will also vary based on ideological motivations, which tend to be reinforced by, but not necessarily beholden to, one's racial, social, or political group identification (Abalakina Paap, Stephan, Craig, & Gregory, 1999; Kramer & Gavrieli, 2005).",1,5
10.1016/j.jesp.2015.11.005,"It appears that the effect is largely dependent on causal attribution processes, and whereas negative outcomes seem to trigger causality appraisals by default, this is not (or less) the case for positive outcomes. However, by making the causal structure of the scenarios salient to our participants, an action–omission effect could be obtained for positive outcomes as well. Interestingly, no matter the outcome condition, the action–omission effectwas increased by explicitly reminding participants of the causal structure of the scenarios, though this increase was rather small in the negative outcome conditions compared to the positive outcome conditions.",0,6
10.1016/j.jesp.2015.11.008,"Greater attitude certainty should increase the consistency between whichever reactions come to mind in a given instance (which as we mentioned, could happen for many reasons, independent of a person's degree of attitude certainty) and the overall evaluation of the target at that moment because those reactions seem especially valid (Briñol & Petty, 2009; Petty et al., 2007a).",0,8
10.1016/j.jesp.2014.09.010,"We examined whether self-esteem was reliably influenced by multiple nonverbal cues encountered across different faces over time. We focused here on the well-studied combination of eye-gaze and facialemotion (cf. Adams, Franklin, Nelson, & Stevenson, 2010). In each of two studies, participants completed self-esteemmeasures after viewing a series of faces that varied—on a between-subjects basis—with respect to emotion expression and eye gaze. We expected exposure to negative (versus positive) facial emotion to reduce perceivers' self-esteem but only when those faces exhibited direct-gaze (i.e., were “looking at” perceivers).",0,10
10.1016/j.jesp.2015.04.001,"These firm beliefs should limit rightists' willingness to consider fleeing, even when experiencing fear. Additionally, the literature suggests that rightist ideology is associated with over-active fear responses and needs for certainty and security precisely because it functions to reduce fear and answer these needs (Jost et al., 2009). It follows that rightist ideology, in answering these needs, regulates the effects of fear by providing clear guidelines on how to react to ideologically-relevant threats—a notion supported by findings on ideological differences in the impact of emotions on policy support (Pliskin, Bar-Tal, Sheppes, & Halperin, 2014).",0,1
10.1016/j.jesp.2014.07.013,"Businessmen are also told to control their emotions during negotiations, and one of the keys to successful business leadership is believed to be the ability to exercise this control (Williams, 2007). If thoughts about money dispose individuals to view their interactions with others as business-like relationships, and if the expression of emotion is considered inappropriate in these relationships, it seems likely that activating concepts ofmoneywill influencenot only people's own expressions of emotion but their expectations for others also.",0,8
10.1016/j.jesp.2011.12.005,"Schematic processing of such visual stimuli is, in our opinion, rather unlikely when participants are confronted with the visual stimuli prior to reading the case-related information or when the visual stimuli do not fit the narrative of the case, and could therefore not be expected. Whereas unexpected stimuli might affect participants' blame judgments to an equal degree, on a process level these cues should not be associated with schematic biases such as hypervigilance or ease of processing. Consequently, we assume that schematic processing is highly dependent on participants' expectations.",0,1
10.1016/j.jesp.2012.02.002,"Similarly, mental contrasting should not produce cognitive dissonance that is reduced by effort justification (i.e., facing obstacles is effortful and this effort needs to be justified by increasing one's commitment to realize the desired future). In line with this argument, mental contrasting is observed to foster goal pursuit when minor obstacles are considered (i.e., expectations of success are high), but to lower goal pursuit when major obstacles are considered (i.e., when expectations of success are low).",0,9
10.1016/j.jesp.2012.04.012,"It is also consistent with the finding that men are perceived to be deficient in agentic attributes when working in female‐dominated occupations and job contexts (Heilman & Wallen, 2010). Alternatively, the proportion of stereotyped individuals in a group (in this case women) might be an emergent property of the group itself, which may color the perceptions and experiences of its members.",0,7
10.1016/j.jesp.2010.11.006,"Finally, Förster (2009; Experiments 8, 9) demonstrated that both power and regulatory focus map onto the differentiation processes induced by processing styles: low-power and prevention focus participants generated more dissimilarities than similarities, whereas high-power or promotion focus participants generated more similarities. Taken together, these findings suggest that prevention focus and low power narrow conceptual and perceptual scope, leading to a detailed and concrete processing. Empathic concern requires selfother differentiation and consists of ‘zooming in’ on concrete otheroriented feelings of warmth and compassion (i.e., feelings different from those of the other).",0,5
10.1016/j.jesp.2011.05.010,"Moreover, studies examining the component parts of warmth judgments find that traits related to the morality component (e.g., honesty, sincerity, and trustworthiness) are dominant in forming global impressions of others relative to other components of warmth (such as sociability; Brambilla, Rusconi, Sacchi, & Cherubini, 2011). In short, social perception is at its root person perception, and person perception appears to place special weight on moral traits. From a functional perspective, it makes sense that people would show a concern for moral character.",1,5
10.1016/j.jesp.2010.02.004,"Because norm-violations without a salient explanation create negative affect (McGraw, 1987), people in an explanatory vacuum should be highly motivated to interpret and justify their behavior (Stone & Cooper, 2001). Stapel and Koomen have found that when people are extramotivated to explain an ambiguous behavior, they will apply accessible information ‘‘more readily and more extensively” (2001, p. 916). We hypothesize that individuals in an explanatory vacuum are extramotivated to interpret their behavior, and will therefore use accessible goal information readily and extensively, settling for explanations that will merely suffice.",0,9
10.1016/j.jesp.2009.02.006,"The third aspect which is crucial in studying the process of negotiations is behavior itself. Decisions of appropriateness (or schemas) drive norms and behavior (Messick, 1999). Different behaviors in the same situation might result because of different judgments about what is appropriate behavior. However, the existence of norms does not always mean that people also behave in accord with these norms (e.g. Harms & Skyrms, 2008). Allocators might only care about norms because of self-presentation effects, wanting others to think they have obeyed the norm in order to maximize their own outcome.",0,6
10.1016/j.jesp.2009.06.014,"The split-face paradigm disrupts holistic-based processing while enhancing feature-based processing in identity judgments (Le Grand et al., 2004). Therefore, attractiveness judgments of split-faces should rely more on features, which represent sexually-dimorphic information, thereby enhancing sexual face preference judgments. Thus, from a dual-route framework, we hypothesized that split-half faces should change the pattern of processing for mate-relevant stimuli by disrupting holistic processing that is critical to aesthetic preference while enhancing sexual preference derived from masculine features.",0,10
10.1016/j.jesp.2009.07.003,"For instance, although affect certainly plays a part in dissolution decisions, relationship researchers have argued that the final decision to end a romantic relationship is largely determined by a carefully reasoned decision process that considers the cost and rewards of staying versus leaving in terms of alternatives and barriers to the relationship (Edwards & Saunders, 1981; Thibaut & Kelley, 1959). However, affect associated with one’s partner (i.e., IPA) may influence the interpretation of ambiguous partner behaviors, which then influences relationship behaviors, and in turn relationship quality.",0,8
10.1093/jcr/ucx080,"You sustained blunt force trauma injuries to your C4 vertebrae, part of the cervical spinal column in your neck, and you have a hematomyelia, an intramedullary spinal cord hemorrhage. You have two options. Option 1: You can choose to undergo surgical evacuation of the hematoma, the extravasated blood that has collected around your C4 vertebrae, and endovascular embolization to selectively occlude the affected blood vessels and arrest the bleeding.",0,6
10.1093/jcr/ucx057,"Indeed, consumers often rely on perceived effort to ascertain the value and quality of an ad, product, or service (Kirmani 1990; Kruger et al., 2004; Morales 2005). In the case of nondurable goods, the consumption of an aesthetically appealing product involves damaging its product design, and by extension, destroying the effort originally invested in making the product beautiful. Based on this perspective, we posit that people refrain from using products imbued with effort, as this indirectly entails destroying something they reward and appreciate.",0,4
10.1093/jcr/ucx066,"Please give me a minute as I load up another application.” In the MEL baseline-absent condition, the employee does not refer to the baseline ($130 for four hours), but directly mentions the six-hour wait. Next, all MEL participants saw the following two options: option A, take the current flight (don’t wait, get no money); and option B, take the later flight Downloaded from https://academic.oup.com/jcr/article-abstract/44/4/833/3782743 by Adam Ellsworth, Adam Ellsworth on 14 November 2017 (wait six hours for the next flight, get money). They then indicated the minimum amount of money that they would require to choose option B.",0,2
10.1093/jcr/ucx067,"You find an item that seems to fit what you want, but first you decide to read what previous purchasers have to say about it. In this case, you see the previous customer ratings in terms of the style (e.g., type/color/your fashion sense) [quality (e.g., material/durability/comfort)] of the shoes you are considering. Downloaded from https://academic.oup.com/jcr/article-abstract/44/4/759/3788001 by Adam Ellsworth, Adam Ellsworth on 14 November 2017 After reading this scenario, participants were randomly assigned to see either a bimodal or unimodal rating distribution.",0,4
10.1093/jcr/ucw008,"2006), higher desirability, and greater temptation associations (Hofmann et al. 2010) are likely to be organized to the right of healthy items. Furthermore, we conceptualize that when food items are laterally displayed in a manner congruent (vs. incongruent) with consumers’ natural mental representation, it enhances the likelihood of choosing healthier options. To elaborate, we propose that consumers experience greater self-control when healthy/unhealthy items are displayed in a manner congruent with their natural mental representation. That is, as demonstrated by studies 2a and 2b, consumers tend to mentally represent healthy items to the left (vs. right) of unhealthy items.",0,2
10.1093/jcr/ucw044,"In accord with the notion that behavior is often guided by the need to maintain gender identity, particularly among male consumers, we posit that one plausible explanation for men’s avoidance of environmentally friendly behaviors is that a pervasive mental association exists between greenness and femininity, such that engaging in green behaviors could threaten men’s masculine identity. Thus we predict that due to the green- feminine association and its effect on social judgments and self-perception, men will be more likely than women to avoid green products and behaviors, particularly when their masculinity is threatened.",1,4
10.1093/jcr/ucv032,"In the “social information survey” participants saw a series of 15 cartoons that each depicted a person doing a certain household chore (e.g., dusting, sweeping, washing dishes, etc.) and described each cartoon as fast as they could using about 15 words in a maximum of 20 seconds. The manner in which participants described the cartoons primed different mentalizing goals. In the engage-inmentalizing condition, participants were instructed to focus on understanding and describing the thoughts and emotions, rather than the physical actions, of the person doing the chores.",0,4
10.1086/680089,"What do you think about companies that donate for moral reasons?” In contrast, respondents in the self-interest condition read, “Companies often make donations to charity because they want the publicity. What do you think about companies that donate for selfish reasons?” The goal of this manipulation was to raise the prominence in consumers’ minds of benevolence and self-interest as alternative motives for engaging in corporate social responsibility. Following the motive manipulation task, all respondents participated in a different study in which they were told that a pharmaceutical company was conducting clinical trials for a new hair loss treatment.",0,6
10.1086/677893,"Having shown that participants preserve categories to lengthen positive experiences and eliminate categories to hasten negative experiences in the lab, we examined whether the same basic pattern might emerge in a real-world setting: how long participants waited to read the final book in a trilogy. Consistent with our lab results, we expected people who enjoyed the trilogy to delay reading the final book in order to avoid completing the experience.",0,9
10.1086/678035,"Instead of predicting quality based on price in the test phase, participants judged the value for money of a high-priced brand with a quality level equal to the actual encountered conditional mean of quality at that price point, on a scale from 1 (bad value for money) to 7 (good value for money). Participants perceived the product to be of worse value for money in the heteroscedastic condition (M p 2.72) than in the homoscedastic condition (M p 3.29; F(1, 55) p 5.20, p ! .05) .",0,6
10.1086/678392,"You don’t have a portable radio with you, and are looking for something that can play music and give decent sound. Fortunately, the campsite manager is able to rent a radio that operates without electricity. The manager told you that because the camp location is remote, you can play only one station.” Given this camping scenario, we assumed that participants would understand that rental price in addition to physical characteristics (e.g., size and weight) represent primary attributes for evaluation and choice.",0,8
10.1086/678194,"The computer-based study was set up such that all participants had to finish watching the full video before proceeding. Participants were told that a memory task would be administered in the end. The two video clips were created using various national publicity movies for China. The images included natural scenery, city scenery, arts, sports, and food. Traditional Chinese music was used as the background music for both clips. While both films had similar scenes, the frames switched from one to the other at a faster pace in the high (vs. low) arousal condition.",0,4
10.1086/668900,"Short of this, Prosper members’ risk taking vanishes to resemble that of baseline (nonmember) participants, thereby mirroring our own findings. Of course, financial decision-making is not the only consumption domain where risk plays a prominent role. As noted earlier, prior research found that consumers’ willingness to try cocaine, an illegal and potentially lethal drug, may increase if doing so boosted their chance of com- D ow nloaded from https://academ ic.oup.com /jcr/article-abstract/40/1/122/1792220 by U niversity of M elbourne Library user on 29 April 2019 mencing social connections (Mead et al. 2011).",0,8
10.1086/669330,"In both conditions, participants are asked to (i) provide two creative usages for a brick, each from a different usage category, (ii) indicate the category of each usage (e.g., construction, art, etc. ), and (iii) avoid naming usages from six specific prohibited categories. In the easy- (vs. difficult)-to-retrieve condition, the prohibited categories excluded roughly 15% (vs. 80%) of the usages that participants in the examined population tend to identify (based on a pretest with a different set of 110 participants). Participants who find it easy to think of usages are expected to perceive themselves as high on creativity.",0,5
10.1086/660838,"Sixty participants took part in the pretest and were randomly assigned to the small or big fork conditions. We offered pasta with either a small or a large fork (these were the same forks that we later used in the restaurant study). After consuming pasta, the participants answered whether or not they found eating the pasta effortful on a 7-point scale (1 p not at all effortful to 7 p very effortful).",0,2
10.1086/661936,"This distinction represents the satiation criterion (Chartrand et al. 2008). This postgoal fulfillment inhibition may be functional for the performance of the next task at hand. Constructs related to a completed intention often become irrelevant and potentially interfere with the next task. If multiple actions need to be performed consecutively, postfulfillment inhibition may occur to facilitate the completion of the next intention. For example, if a shopper plans to purchase a CD and then purchase a new shirt, constructs related to the purchase of the CD may be inhibited to facilitate the purchase of the new shirt.",0,6
10.1086/662613,"The focal company operates on a “movie-in-the-mail” business model. A customer starts by selecting from four service plans. Each of the plans involves a fixed monthly subscription fee and a quota, or the maximum number of movies that can be checked out at any single time. After subscribing to a plan, the customer can log on to the company’s website to browse the inventory of available movies. For each movie, the customer can see the synopsis, the genre, cast information, and the average rating of the movie provided by previous viewers.",0,5
10.1086/658469,"Conversely, individuals with high confidence in the system will prefer these direct means of justifying the system. They will be drawn toward such means because these means allow them to communicate their strong, unwavering confidence in the system in a way that feels meaningful and unambiguous to themselves and others. As their energy is focused on and their defensive needs are satisfied by these explicit means of support, they will not bother with subtle means, including the indirect consumption opportunities that those with low confidence gravitate toward.",0,4
10.1086/657163,"According to Rifkin (1987), since efficiency has become the hallmark and trademark of contemporary culture, we tend to “loathe the very idea of idleness” during “wait states” (a term borrowed from computer science) and attempt to use waiting time in the most economical manner possible. Customers waiting for service or travelers waiting for a delayed train may feel that they are expending a scarce resource—their valuable time (Carmon, Shanthikumar, and Carmon 1995). Consequently such consumers may try to use their waiting time productively.",0,3
10.1086/649028,"Thus, for reasons explained earlier, viewers’ bodily sensation of (dis)comfort is likely to be assimilated with their product assessments. Alternatively, if this distance is minimal and thereby promotes clear visibility and a welldefined representation of the product, people’s bodily sensations are apt to be used primarily as a comparison standard for formally judging the target product. This latter process should foster a contrast effect on viewers’ product assessments. One question that remains, however, is how viewers are likely to use their bodily sensations when the distance that separates them from the product reaches a far extreme.",0,3
10.1086/653139,"In line with self-affirmation theory (Steele 1988), we argue that such consumers will subsequently use the means available to them—in this case, contrasting away from or, at a minimum, choosing to ignore estimates of others’ preferences in formulating their own preferences—to restore their uniqueness-related self-esteem. In other words, high-CNFU consumers are unlikely to introject. However, this outcome is not expected for lowCNFU consumers, since they do not view conformity as a threat to self-esteem (Snyder and Fromkin 1977). Thus, such consumers will use the information available to them—in this case, others’ preferences—to arrive at their own preferences.",0,10
10.1086/593692,"They are lightweight, have extended battery life, high-end security, and extra business and presentation software. Set B These laptops are built for work. They are lightweight, have extended battery life, high-end security, and extra business and presentation software. These laptops are built for fun. They feature high-end graphics cards, top of the line speakers, and extra music and video software.",0,3
10.1086/593690,"In a similar vein, Williams and Gilovich (2006) found that estimates of typical performances were similar to estimates of best performance. Building from theories of selective hypothesis testing (Gettys and Fisher 1979; Sanbonmatsu et al. 1998), we posit that consumers selectively test their (working) ideal hypothesis by focusing on evidence that supports it and neglecting evidence that contradicts it.",0,5
10.1086/592943,"These could be memories of unpleasant situations or of experiences that at one point were special but now are painful to remember. This dynamic was nicely demonstrated in Eternal Sunshine of the Spotless Mind, in which Jim Carrey’s character is eager to get rid of cues that will remind him of happy times spent with his ex-girlfriend. When people are trying to forget memories, they might show avoidance of reexposure to those cues (i.e., memory forgetting through avoidance) because they do not want to cue the earlier memory.",0,8
10.1037/lhb0000265,"Indeed, most all innocents will waive their rights—decisions that are sometimes characterized as mindless acquiescing and other times as knowing (i.e., they understand their decisions) but not intelligent (i.e., they do not appreciate the consequences of their decisions). On the other hand, although unknowing guilty suspects may sometimes acquiesce to interrogators’ requests for a waiver, other guilty suspects will knowingly exercise their rights to remain silent and talk with an attorney (i.e., some guilty individuals are making highly knowing and intelligent pre-interrogation decisions).",0,5
