paper_id,important_segment,label,Fold_Id
10.1287/orsc.2015.0994,"participants reported being less likely to comply with the resource requests of racially diverse teams, M = 2.95, SD = 1.21, than with those of homogeneous teams, M = 3.50, SD = 1.37, F (1, 70) = 3.27, p = 0.075, albeit marginally less so.",0,5
10.1287/orsc.2014.0905,WA dyads from WWN groups were 30% more likely to disband than two person WW groups (p < 0.05),0,9
10.1016/j.compedu.2017.06.003,"we found the same direction of gender differences and effect size (beta in the STDY standardization), B  = 0.371, SE = 0.102, p < 0.001, beta = 0.365.",1,2
10.1016/j.compedu.2015.09.002,"Students spending more than 15 h/week online have a higher degree of behavioural search strategies than their frequent web-visitor peers (beta =  .197, p < .05)",0,10
10.1016/j.compedu.2011.03.011,the latent growth curvemodeling approach (LGM) was utilized as an analytical technique to examine the development of children’s computer skills,1,7
10.1086/664820,"Looking at Shock_Top1ChairOnly, the coefficient implies a 1.2 percent drop in scaled capital expenditures (t = 3.46). Since firms have average capital expenditures of 8 percent of assets,Senate chairmanship causes a roughly 15 percent reduction in the representative firm’s capex. [Coefficient for “Shock_Top1ChairOnly” is -0.012, significant at 1 percent.]",1,3
10.1111/cdev.12720,"Children’s acceptance of the informants’ testimony varies with both the overall pattern and the amount of data they had about the informant’s accuracy; in particular, while children began with considerable trust in the informant, they reduced their trust if she proved inaccurate, especially if she was inaccurate on one of the first two trials.",1,3
10.1111/cdev.12759,"5-year-olds’ inferences about beliefs were affected by the presence or absence of a valence change, b = -1.29, SE = 0.55; chi squared (1, N = 63) = 5.63, p = .018. ",0,2
10.1111/cdev.12723,"There was a main effect of delay type, with greater accuracy in children who slept after training (M = 70%, SE = 0.07) than in those who stayed awake (M = 50%, SE = 0.04), F(1, 35) = 5.63, p = .02, partial eta squared = .14, Cohen’s d = .80",0,5
10.1111/cdev.12500,"Infants’ ability to predict the goal of manual actions directed toward the mouth (i.e. looking at the mouth area of interest prior to the tool reaching the actor’s mouth) varies dramatically between cultural contexts. Chinese infants fixate the mouth before food arrives there, if chopsticks are used to manipulate the food. If a typically Western-style spoon is used to manipulate the food, however, then Chinese infants fail to predict these events. Swedish infants demonstrate the opposite pattern of results, predicting that food being handled by a Western-style spoon will go to the mouth, but fail to predict the same goal when the action is per-formed with chopsticks.",1,7
10.1111/cdev.12508,"Children in the specific contingent group were less likely to pass the simple test than those in the noncontingent group, chi squared(1) = 4.64, p = .031",0,10
10.1111/cdev.12076,"Comparing the risk profile group to the other three groups, there was a significant decrement in fit when constraining all four groups to equality than when freeing the stress–externalizing path for the risk profile group (Table 3, delta chi squared Test B). Thus, Model 1 supported the hypothesis that the stress–externaliz-ing association would be strongest for children with high levels of both resistance and unadaptability | delta chi squared Test A (delta df = 1) = 5.96*, p < 0.05",0,7
10.1111/j.1467-8624.2011.01580.x,"At posttest (May, Grade 1), the CARRI group was on a higher level than the RRI group, t(48) = 2.10, p ≤ .041, Cohen's d = .90",0,4
10.1257/aer.20140260,"We find evidence of substantial under- and overweighting of key risk factors, relative to the weights that would maximize test yields…The marginal effect reports that physicians are 0.9 percentage points less likely to test a patient with a prior inpatient admission within the past 30 days, implying that doctors have underestimated these patients’ PE risk by 11 percentage points after accounting for the role of other observed comorbidities. [For ""Prior hospital visit within 30 days”, marginal effect is -0.0094, misassessment of PE risk is 0.1070. Standard error of misassessment is 0.0121.]",1,10
10.1257/aer.101.7.3019,"Table 4 panel A provides evidence to this effect…The paper finds evidence of a 14 percent increase in black enrollment in the long run, defined as at least five years after implementation of desegregation. [The coefficient for ""Desegregated (5+)” = 0.14.]",1,3
10.1111/jofi.12059,"Across different samples and using...Patent Index...as a measure of innovation output, the paper shows that firms with higher innovation output are more likely to become acquirers. In Table III, Panel A, [the coefficient for “Patent Index” is 0.273, significant at the 1% level.]",1,10
10.1016/j.cedpsych.2013.04.004,"The opportunity factor was positively related to pre-kindergarten mathematics achievement, beta [standardized path coefficient] = .28 (SE = .10), p < .05.",0,7
10.1016/j.cedpsych.2013.07.005,"Significant between-group differences were found in achievement: Group 3 showed the highest achievement, followed by Group 2 and Group 1 (from Table 5, means for 'Grades': Group 2 [Father Low] = 69.90_b; Group 3 [Moderately autonomy-supportive] = 73.81_c; Different subscripts indicate significant differences at p < .05 on post hoc comparisons using Tukey HSD.).",0,1
10.1016/j.cedpsych.2010.04.001,"A comprehension skill difference was observed for the PM condition; high-skilled readers showed more positive amplitudes than less-skilled readers, t(32) = 2.25, p < .05.",0,6
10.1016/j.cedpsych.2009.07.001,"Task-focused behavior – when measured in grade 2 – continued to predict uniquely spelling (4%, p < .05) in grade 3, even when the authors controlled for the effects of the autoregressor.",0,7
10.1093/sf/sox047,"Although short-term custody (STC) is viewed as an alternative to returning parole violators to prison, they also have the potential to adversely affect earnings.",1,6
10.1093/sf/sou117,The gap was striking among low-educated married mothers (selected finding): 76.6 percent were employed in Finland versus 50.9 percent in the United States.,1,9
10.1093/sf/sot045,Individuals who attend religious services more frequently will rate self-enhancement less highly than those who attend less frequently.,1,6
10.1016/j.jfineco.2014.09.003,"The coefficient of the tightness variable is positive and statistically significant at the 5% level. This finding is consistent with our hypothesis that stock price comovement is higher in culturally tighter countries. [The coefficient for “Tightness” is 0.040, p-value = 0.030.]",0,5
10.1016/j.jfineco.2014.02.004,"Column 1 shows the result of a regression of Q on PHI without additional control variables. We find a negative correlation between them, which is statistically significant at the 5% level. The point estimate of  0.22 indicates that, for a one standard deviation increase in PHI, 0.19, Q is reduced by 0.042, which corresponds to 2.24% of its sample average (1.87). This is an economically significant effect. T-stat using standard errors clustered at the firm level is -2.29.",0,7
10.1037/edu0000090,"Average rate of growth in math was also predicted by the children’s WMU capacity at kindergarten (beta = .312, p < .001). kindergarteners with higher WMU capacity improved in math faster than did those with lower WMU capacity.",1,2
10.1037/a0027216,"Simple effects of these interactions indicated that the RD group scored significantly better in the high-novelty condition than the low-novelty condition on Causality Level 3 (see Figure 1B), F(1, 14) = 8.65, p = .011, d = 1.1.",0,1
10.1037/a0023655,"Compared with children from homes in which mostly English was spoken at age 4.5 years, students who were from homes in which equal amounts of Spanish and English were spoken had a higher rate of growth (gamma_11 = 0.4, p < .001).",1,9
10.1037/a0016306,"Across all three studies, student-level perceptions of class or school standing were positively associated with self-concept; furthermore, class-average student perceptions of class standing predicted self-concept.",1,8
10.1093/esr/jcx071,"This decrease [in the public acceptance of immigrants in Germany], however, does not universally relate to all immigrants in the same way. It was about twice as large for immigrants from the Middle East and Africa compared with those from France; the finding for immigrants from the Middle East is the portion selected.",1,6
10.1093/esr/jcp054,"The homogamy effects bring out quite well the anticipated bi-modal scenario. Alone, homogamy actually reduces caring time but the effect turns strong and positive for highly educated couples, producing about 5 per cent more maternal care (from 'Child care' column in Table 3, 'Homogamy x high education' term: B = 0.200; SE B = 0.092; P < 0.05).",0,10
10.1093/esr/jcn050,"Social capital, in almost every form, is socially stratified everywhere in Europe. The biggest differences arise in formal participation in civil society. Higher social classes, including people in professional or managerial jobs are more embedded in a broader range of networks through their activities in formal associations.",1,9
10.1177/0149206311407508,Time spent on task performance is important in determining subjective performance evaluations in an outcome-based control system.,1,4
10.1177/0149206311430262,"hourly levels of DIS-SP were related only to subsequent NA (negative affect) (B = –0.02, p < .05).",0,10
10.1257/app.20150517,Column 3 of Table 1 adds community-specific measures of economic shocks over the course of the 1990s. This is our preferred specification. [The coefficient for “Prevalence of emigration to the West (percent)” is -0.63 with standard errors of 0.18.],1,9
10.1257/app.3.3.55,"As before, the results become stronger when moving to a specification of tax code fixed effects interacted with calendar-quarter fixed effects (column 6). The interaction effect of high leverage and seller’s hint shows that prices are inflated by up to 8.6 percent. [Coefficient for “100% < LTV x Seller Hint” is 0.038, implying an effect on prices by -0.086. Standard errors are clustered at the zip code level. Significant at the 1 percent level.]",1,5
10.1177/2167702618776947,"In the overall mediation model, there was an indirect effect of prospective IU on LHA total scores through vlPFC activation (c′ path: b = 0.18, SE = 0.11, 95% CI = [0.03, –0.46]; Fig. 3)",0,8
10.1016/j.worlddev.2016.03.006,"Once the level of democracy is held constant, a higher level on the Impartiality index implies a higher probability of being on a sustained growth path (from column (1) of Table 3, 'Log Impartiality index' term: estimate = 0.18; robust SE = 0.09; p < 0.05).",0,4
10.1016/j.worlddev.2015.01.014,"Regression results from the estimation of the system of three simultaneous equations (Table 8) show that the coefficients that relate to the three hypotheses proposed to assess the success of a project provide evidence that...in all projects, the application by households of a higher number of options was associated with increased crop diversity (from Table 8, 'Ecuador - A' column, 'Application of options' term: estimate = 0.231; significant at the .001 level for a one-tail t test corresponding to the alternative hypothesis Ha: parameter of interest > 0).",1,1
10.1016/j.worlddev.2014.08.013,"The test of equality of the coefficients (except the intercept) between the lower quantiles and the upper quantiles reject the hypothesis of parameter homogeneity except the trade openness and financial openness (from Table 6, 'Panel (A) Polity measure', 'Against the 0.95 quantile' column, 'Polity2' term: Test statistic = 12.920; p-Value = 0.0003; significant at 1%).",1,6
10.1016/j.worlddev.2014.05.013,"Relative to other countries at its level of income, its superior performance in secondary school enrollment is explained mainly by a 14-percentage point abnormally high record for females in 2001–05 (from Table 2, '2001-05' analysis for 'School enrollment, secondary, female (% gross)': estimate = 14.84; heteroskedasticity-robust SE = 2.57; significant at 1% level (two-tailed test)).",1,1
10.1016/j.worlddev.2014.06.010,"The IV estimates are much larger than the OLS estimates and suggest that a 10% increase in the proportion with 8 years of schooling raised the proportion that paid at least one antenatal visit to a health facility during the first trimester of pregnancy by 6 percentage points (from Panel 1 in Table 4, 'Antenatal visit during the first trimester' column, 'IV estimates -- Schooling = 8 years or more' row: estimate = 0.58; SE clustered on the region of childhood residence = 0.31; 0.05 less than p less than or equal to 0.1).",0,1
10.1016/j.worlddev.2013.05.015,"In Table 4, as expected, a high dependence on oil or mineral exports associates with relatively low areas of cultivated land (from column '(1) All nations' in Table 4, 'Dutch disease: oil-mining (% of exports)' term: estimate = -.019 (.003); p < .001).",1,4
10.1016/j.worlddev.2012.04.001,"In this paper the authors use the “system GMM” [General Methods of Moments] approach developed by Arellano and Bond (1991) and Blundell and Bond (1998). A simultaneous equation system conveyed in equations 4-8 is employed for the estimation, where the outcome variable is the unit price of a variety i from country k in import market j and year t. The focal term is the price of China’s exports. Table 1 reports the estimated results for the whole sample. The selected results come from the analysis of middle-income countries (see 'P_Middle' column in Table 1 for details).",1,10
10.1016/j.worlddev.2010.05.011,"In this case, the estimated coefficient of the interaction term is significantly positive, indicating that positive leverage can be gained by firms investing in both in-house R&D and FTI ('RD*FTI' term: coefficient = 0.124; SE = 0.047; p < 0.05).",0,7
10.1016/j.worlddev.2010.02.010,"The estimated coefficient on rural remote location in this specification is equal to -0.48 and is significantly different from zero at the 5% level (from column (3) in Table 5, 'Rural other' term: coefficient = -0.479; SE robust to heteroskedasticity = 0.199).",0,6
10.1016/j.worlddev.2010.02.011,"Underemployment here again has a significantly positive impact on the earnings of independent workers in the informal sectors of the seven cities (from Table 8, 'Niamey' column, 'Axis 2 — Independent workers: underemployment' row: estimate = 0.062 (0.015); The standard errors are bootstrapped (500 replications).; Significant at the 1% level).",1,3
10.1016/j.worlddev.2008.04.003,"The coefficient estimate for the interaction term is -0.565 (z-Statistic = -8.4; Odds ratio, % Change = 57). It is statistically significant at the 1% level (two-tailed test).",1,9
10.1016/j.worlddev.2008.08.002,"Distance to market centers, a proxy for market pressure, is significant at alpha 0.10...The author finds that the distance of the irrigation system to commercial centers — a proxy indicator of market pressure — is negatively associated with monetary free riding and the result is statistically significant. Consistent with the hypothesized expectation, irrigation systems that are at least one hour away from commercial centers have lower levels of monetary free riding (from Table 2, 'DISTMKT' predictor: Coef. = -2.345; SE Coef. = 1.332; T = -1.76; P = 0.079).",0,9
10.1016/j.worlddev.2008.01.004,"As the Tobit regression results (Table 6) suggest, debt relief in the period 2000–04 seems to be positively related to improvements in governance quality, though only three out of ten governance indicators reach sufficient significance levels. However, these results support the hypothesis that donor country governments have learned and adapted their behavior (from the 'X' column of Table 6, 'delta GOVEFF 2–3' term: estimate = 5.55; absolute z-value = 2.00; Significant at the 5% level.).",0,9
10.1093/qje/qjt005,"The estimates show that in countries with a tradition of plough use, women are less likely to participate in the labor market. [The coefficient for “Traditional plough use” is -14.895, significant at the 1% level.]",1,7
10.1086/599707,"panel B shows that the elasticity of the total payments inNorth Sumatra with respect to the expected number of checkpoints on the route is -0.736. [coefficient for “Log expected checkpoints on route” is -0.736, with Newer-West standard errors of 0.064, significant at 1 percent.]",1,9
10.1111/cdev.12760,"Associations between age of attainment of individual milestones and full-scale IQ were estimated in two linear regression models; the selected analysis is the fully adjusted model for the 'forming a sentence' predictor, which included the age of attainment of the milestone, sex, parental social status, parity, cigarette consumption, gestational age, and birth weight",1,3
10.1257/aer.101.4.1601,"All results show the same pattern: ...the block significantly reduces contribution level. [The coefficient of “AfterBlock” is -0.463, with heteroskedasticity-adjusted standard errors of 0.044, significant at the 1 percent level.]",1,1
10.1111/jofi.12490,"Column (1) reports OLS estimates. [The coefficient for “Financial assets” is 0.681 with standard errors of 0.102, significant at 1%.]",1,9
10.1093/sf/sox086,"Grandparental wealth is associated with grand-child wealth, net of parental wealth.",1,4
10.1093/sf/sov097,"The results for the contextual factors, especially the positive effect for sit-ins, are our most important findings. Though living in a county near a sit-in county did not significantly influence opinions about civil rights protest, living in a county where one occurred did. Specifically, controlling for individual-level and other contextual factors, the probability of white Southerners who lived in a sit-in county approving of the protest tactic was nearly three times that of those who resided in a county without or nearby a sit-in. (B = 1.091, SE = .520, OR = 2.977, p < .1)",0,8
10.1093/sf/sov124,"According to hypothesis 1a, the greater the appeal of a protest event’s claims, the more likely the protest’s participants will utilize nonviolent disruptive tactics. Model 2 in table 3 gives evidence in support of this assertion. Specifically, as the aggregate claim appeal of a protest event increases by one standard deviation, the odds of the protest using nonviolent disruptive tactics relative to only non-disruptive tactics rise by approximately 8 percent (exp(0.073) = 1.075, p < .001, model 2, table  3).",1,6
10.1093/sf/sov048,"Model 4 indicates that having at least one affection-based social circle significantly moderated the effect of layoff on private entrepreneurship - including “layoff × at least one affection-based circle” in model 4 significantly improved the fit of the model (p = .03, b = 2.52, Robust SE = 1.18).",0,10
10.1093/sf/sot018,"Among high-wage occupations, the negative effect of women’s representation on occupational wages becomes more severe over time, from g = -0.28 to g = -0.42, although significant only at (T = 1.46, p > .10) (see Table 2b).",0,9
10.1016/j.jfineco.2016.09.005,"The Law × Movable interaction term is positive, large, statistically significant, and stable across all three specifications. According to the results of control Column 1, the difference between the LTV of movables and immovables-collateralized loans is 27.6 percentage points higher in strong-law countries than in weak- law countries. [coefficient for “Law x Movable” is 0.276, standard errors clustered using block-bootstrapping at the country-level of 0.047, significance at the 1% level.]",1,3
10.1016/j.jfineco.2013.02.003,"...in line with Prediction 2, the coefficient of Entrant BG Total Cash is positive and significant. Group-backed entry in a market is facilitated when the entrant groups have piled up large cash reserves in their originating markets. [The coefficient for “Entrant BG Total Cash” is 0.005 with robust standard errors clustered at the three-digit standard industrial classification level of 0.001, statistically significant at the 1% level.]",1,7
10.1287/mnsc.2016.2717,Using a chi squared test which reports the test statistic for the diﬀerence between the High − Low spread for hedging firms and nonhedging firms.,1,3
10.1287/mnsc.2013.1868,"Our main result is that the relative frequency of risk-vulnerable subjects is significantly larger than 50% (binomial test, p = 0.000).",1,8
10.1287/mnsc.2014.2013,"As the theory predicts, ERP is associated with greater autonomy of plant managers.  From Table 3, the coefficient for ERP predicting plant manager autonomy = 0.150, significant at the 10% level.",0,4
10.1287/mnsc.1090.1131,"an increase of one standard deviation in morning profits leads to a change of approximately 8% of one standard deviation in the afternoon number of trades.  Although the coefficient on the afternoon number of trades is small, it is statistically significant.  From Table 3, model coefficient = 0.077.",1,3
10.1287/mnsc.1090.0995,"Further investigation of the data suggests that the firms including penalty clauses in their contracts are those with a greater number of prior deals. From Table 9, simple probit coefficient for prior deal experience = 0.586, significant at the 5% level.",0,2
10.1093/esr/jcy038,"The effect of terrorist attacks in neighbouring countries remains (from Model 2 in Table 3, 'Terrorist attack in neighbouring country' term: estimate = 0.337; t-value = 4.23; P < 0.001).",1,5
10.1093/esr/jcx057,"The deviation between regional-level unemployment and the national trend — ‘structural component’ 2, which represents the typical regional situation — is significantly negative (from Table 2, Model 1, 'Component 2: Typical regional unemployment' term: AME [average marginal effect] = -0.003; clustered S.E. = 0.001; P < 0.05). The relatively clear impact of this component suggests that structural differences between regions are typically more relevant than the impact of de-trended unemployment (Component 3). This means that persistently high unemployment in one’s own living area decreases an individual’s chance of obtaining a dual training place. Hypothesis 4a can be confirmed.",0,5
10.1093/esr/jcv136,"The results of this study indicate that the same individual is less satisfied with life in those years, in which inequality is higher than the average inequality that he/she experienced during his/her multiple interviews.",1,7
10.1093/esr/jcu083,"Most notably, school quality and educational stratification contribute substantially to explaining country variation in training returns; the finding for school quality is the portion selected.",1,6
10.1093/esr/jcu075,The interaction term shows a significant negative relationship (b = -0.016; t ratio = -2.64; P = 0.022).,0,9
10.1093/esr/jcs047,"Educational attainment of the parents is the most important factor for the access to family social capital. Labour market entrants whose parents are both lower educated have 12 per cent less labour market information than entrants whose parents are both higher educated (p. 690) (from Model 2 in Table 3, 'Both lower educated/unknown' term: per cent change score = -12; P < 0.001).",1,8
10.1093/esr/jcq021,"Second-generation immigrants from the Nordic countries choose almost exactly as the majority population, whereas students from all other immigrant groups much more often select the academic alternative (from 'Boys -- Model 2' in Table 7, 'Middle East' term: AME [average marginal effect] = 0.205; SE = 0.008; P less than or equal to 0.001).",1,1
10.1093/esr/jcn081,"This interaction effect turns out to be significant positive: Turkish children can profit more from a higher frequency of familial activities if their parents speak German with them more frequently (from Model 8 in Table 3, 'Frequency of communication in German x Activity score' term: unstandardized regression coefficient = 1.57; robust SE adjusted for post code clusters = 0.48; P less than or equal to 0.05) (see Figure 1).",0,3
10.1257/app.4.1.136,"Without sorting, sharing is comparable to previous experiments, €1.87 on average in Barcelona... Most subjects share a positive amount (60 percent in Barcelona...). However, the introduction of sorting strongly decreases the average amount shared to only €0.58 in Barcelona...decreases are statistically significant in a nonparametric rank-sum test (Barcelona: z = 3.39, p < 0.001...).",1,1
10.1016/j.learninstruc.2018.01.008,"Students in the text condition more frequently reported strategy use related to understanding difficult vocabulary (25.6%, n = 10), than did students in the video condition (5.1%, n = 2), Χ^2(1) = 6.30, p < 0.05, Cramer's V = 0.28.",0,5
10.1016/j.learninstruc.2012.08.006,"Significant predictor covariates included problem type (beta_problem = 1.60, chi-square = 56.10, df = 1, p < 0.0001).",1,3
10.1016/j.learninstruc.2012.11.001,"The authors' main goal is to investigate if the effect of the CFC program on student achievement will be mediated by changes in quality of text discussion. Since they are interested in student level outcomes, the mediator is at the teacher level, and random assignment occurred at the school level, they use a 3 -> 2 -> 1 mediation design (Pituch et al., 2010). To test the indirect effect, they followed the procedure described by Pituch et al. (2010). They constructed confidence intervals using the Sobel (1982) standard error (see p. 41). They used the PRODCLIN software program to test the significance of the indirect effect.",0,10
